{
  "$schema":"http://json-schema.org/draft-07/schema#","$id":"https://agentic-website-studio.local/schemas/project-brief.schema.json","title":"Original Project Brief","type":"object","additionalProperties":false,
  "required":["schemaVersion","projectId","workingTitle","purpose","targetAudience","desiredExperience","expectedSessionLength","narrativeGoal","interactionGoal","visualAspirations","platformConstraints","accessibilityExpectations","mobileExpectations","engineeringConstraints","creativeRightsMode","prohibitedExpressions","mustHaveQualities","unwantedQualities","openQuestions"],
  "properties":{"schemaVersion":{"const":"1.0.0"},"projectId":{"type":"string","pattern":"^project_[a-z0-9_-]+$"},"workingTitle":{"$ref":"#/definitions/text"},"purpose":{"$ref":"#/definitions/text"},"targetAudience":{"$ref":"#/definitions/texts"},"desiredExperience":{"$ref":"#/definitions/texts"},"expectedSessionLength":{"$ref":"#/definitions/text"},"narrativeGoal":{"$ref":"#/definitions/text"},"interactionGoal":{"$ref":"#/definitions/text"},"visualAspirations":{"$ref":"#/definitions/texts"},"platformConstraints":{"$ref":"#/definitions/texts"},"accessibilityExpectations":{"$ref":"#/definitions/texts"},"mobileExpectations":{"$ref":"#/definitions/texts"},"engineeringConstraints":{"$ref":"#/definitions/texts"},"creativeRightsMode":{"enum":["original","permissioned_or_licensed","third_party_adaptation_requires_human_review"]},"prohibitedExpressions":{"$ref":"#/definitions/nonemptyTexts"},"mustHaveQualities":{"$ref":"#/definitions/nonemptyTexts"},"unwantedQualities":{"$ref":"#/definitions/texts"},"openQuestions":{"$ref":"#/definitions/texts"}},
  "definitions":{"text":{"type":"string","minLength":1,"maxLength":2000},"texts":{"type":"array","maxItems":50,"uniqueItems":true,"items":{"$ref":"#/definitions/text"}},"nonemptyTexts":{"type":"array","minItems":1,"maxItems":50,"uniqueItems":true,"items":{"$ref":"#/definitions/text"}}}
}
